{
  "$schema": "https://json-schema.org/draft/2020-12/schema",
  "$id": "https://openbindings.com/conformance/binding-specs/processor-scenario.schema.json",
  "title": "OpenBindings binding-specification processor scenarios",
  "description": "Portable semantic scenarios for binding-specification P-rules. Family adapters translate the semantic configuration points and peer scripts into an implementation's API and normalize observations; an actual observation passes when it satisfies every assertion in any one expected alternative. Revision 3 adds the notContains assertion so a scenario can pin the absence of a substring - a header never emitted, a field never serialized. Revision 4 adds lossless caller-input materializations for hostile string code units that the corpus JSON representation cannot carry portably. Revision 5 adds semanticEquals so permitted JSON byte variation does not weaken value, field-ownership, or sequential-order evidence.",
  "type": "object",
  "required": ["format", "bindingSpec", "family", "description", "scenarios"],
  "additionalProperties": false,
  "properties": {
    "format": {
      "enum": [
        "openbindings.binding-spec-processor-scenarios@1",
        "openbindings.binding-spec-processor-scenarios@3",
        "openbindings.binding-spec-processor-scenarios@4",
        "openbindings.binding-spec-processor-scenarios@5"
      ]
    },
    "bindingSpec": {
      "type": "string",
      "pattern": "^openbindings\\.(usage|asyncapi|mcp|grpc|connect|graphql)@[1-9][0-9]*$"
    },
    "family": {
      "enum": ["usage", "asyncapi", "mcp", "grpc", "connect", "graphql"]
    },
    "description": { "type": "string", "minLength": 1 },
    "scenarios": {
      "type": "array",
      "minItems": 1,
      "items": {
        "type": "object",
        "required": [
          "id",
          "rules",
          "section",
          "description",
          "given",
          "expected"
        ],
        "additionalProperties": false,
        "properties": {
          "id": {
            "type": "string",
            "pattern": "^(USAGE|ASYNC|MCP|GRPC|CONN|GQL)-PS-[0-9]{2,}$"
          },
          "rules": {
            "type": "array",
            "minItems": 1,
            "uniqueItems": true,
            "items": {
              "type": "string",
              "pattern": "^(USAGE|ASYNC|MCP|GRPC|CONN|GQL)-P-[0-9]+$"
            }
          },
          "section": { "type": "string", "minLength": 1 },
          "description": { "type": "string", "minLength": 1 },
          "given": {
            "type": "object",
            "required": ["source", "binding", "invocation"],
            "additionalProperties": false,
            "properties": {
              "source": { "type": "object" },
              "binding": { "type": "object" },
              "configuration": {
                "type": "object",
                "description": "Values keyed by the specification's semantic configuration-point names; concrete API carriage is deliberately not implied."
              },
              "invocation": {
                "type": "object",
                "required": ["inputPresent"],
                "properties": {
                  "inputPresent": { "type": "boolean" },
                  "input": {},
                  "inputMaterializations": {
                    "type": "array",
                    "minItems": 1,
                    "items": { "$ref": "#/$defs/inputMaterialization" }
                  },
                  "writes": { "type": "array" }
                },
                "additionalProperties": true
              },
              "peer": {
                "type": "object",
                "description": "A family-specific scripted transport/process outcome supplied by the harness adapter."
              },
              "runtime": {
                "type": "object",
                "description": "Named runtime facts such as an implemented usage version, supplied credentials, or a portable codec capability map. In requestCharacterEncodings, responseCharacterEncodings, requestContentCodings, and responseContentCodings, keys compare case-insensitively and values name deterministic harness actions. The reserved action unavailable makes that direction's capability absent even when an adapter has a built-in codec; fail makes the capability raise if invoked; identity copies the exact test bytes or code points unchanged. Other nonempty action names select scenario-defined deterministic codecs such as unwrap or reverse.",
                "properties": {
                  "requestCharacterEncodings": { "$ref": "#/$defs/codecCapabilityMap" },
                  "responseCharacterEncodings": { "$ref": "#/$defs/codecCapabilityMap" },
                  "requestContentCodings": { "$ref": "#/$defs/codecCapabilityMap" },
                  "responseContentCodings": { "$ref": "#/$defs/codecCapabilityMap" }
                },
                "additionalProperties": true
              },
              "resources": {
                "type": "object",
                "description": "A closed, immutable artifact dependency set keyed by absolute retrieval URI. Family adapters expose these resources through their ordinary artifact resolver; this is harness input, not an OBI document field.",
                "propertyNames": {
                  "pattern": "^[A-Za-z][A-Za-z0-9+.-]*:",
                  "description": "Absolute URI spelling; adapters do not infer a base for corpus resources."
                },
                "additionalProperties": {
                  "description": "The parsed object or source text returned for this artifact URI.",
                  "oneOf": [
                    { "type": "object" },
                    { "type": "string" }
                  ]
                }
              }
            }
          },
          "expected": {
            "type": "array",
            "minItems": 1,
            "description": "Permitted observation alternatives. Several entries preserve an upstream-permitted set; their order is not a preference.",
            "items": {
              "type": "object",
              "required": ["disposition", "phase", "assertions"],
              "additionalProperties": false,
              "properties": {
                "disposition": {
                  "enum": ["complete", "error", "refusal", "context-required"]
                },
                "phase": {
                  "enum": [
                    "load",
                    "resolution",
                    "pre-dispatch",
                    "dispatch",
                    "response",
                    "completion"
                  ]
                },
                "description": { "type": "string" },
                "assertions": {
                  "type": "array",
                  "description": "Optional facts about the normalized observation beyond disposition and phase. Portable scenarios assert only wire dispatch or operation-value facts fixed by the governing binding specification; diagnostic error objects and concrete context-challenge record shapes are outside this format's comparison boundary.",
                  "items": {
                    "type": "object",
                    "required": ["path"],
                    "additionalProperties": false,
                    "properties": {
                      "path": {
                        "type": "string",
                        "pattern": "^/",
                        "description": "JSON Pointer into the adapter's normalized observation."
                      },
                      "equals": {},
                      "absent": { "const": true },
                      "oneOf": { "type": "array", "minItems": 1 },
                      "setEquals": { "type": "array", "uniqueItems": true },
                      "contains": {},
                      "notContains": {},
                      "semanticEquals": { "$ref": "#/$defs/semanticEquality" }
                    },
                    "oneOf": [
                      { "required": ["equals"] },
                      { "required": ["absent"] },
                      { "required": ["oneOf"] },
                      { "required": ["setEquals"] },
                      { "required": ["contains"] },
                      { "required": ["notContains"] },
                      { "required": ["semanticEquals"] }
                    ]
                  }
                }
              }
            }
          }
        }
      }
    }
  },
  "$defs": {
    "inputMaterialization": {
      "type": "object",
      "description": "Corpus-only preprocessing of a JSON-safe caller-input template. Before invocation, the adapter replaces the null placeholder at path with one string containing exactly the listed UTF-16 code units, including at least one unpaired surrogate, without normalization or replacement; this record itself never reaches the processor.",
      "required": ["path", "kind", "codeUnits"],
      "additionalProperties": false,
      "properties": {
        "path": {
          "type": "string",
          "pattern": "^/",
          "description": "JSON Pointer into invocation.input naming a null placeholder."
        },
        "kind": { "const": "unpaired-utf16-code-units" },
        "codeUnits": {
          "type": "array",
          "minItems": 1,
          "items": { "type": "integer", "minimum": 0, "maximum": 65535 }
        }
      }
    },
    "codecCapabilityMap": {
      "type": "object",
      "description": "Case-insensitive codec name to a deterministic harness action. unavailable forces absence in this direction; fail raises if invoked; identity copies the exact test bytes or code points unchanged.",
      "propertyNames": { "type": "string", "minLength": 1 },
      "additionalProperties": { "type": "string", "minLength": 1 }
    },
    "semanticEquality": {
      "type": "object",
      "description": "A harness-level semantic interpretation of the value at path. The interpreter validates the complete named field, part, query contribution, or sequential framing and compares its parsed JSON value without fixing an equivalent JSON byte spelling.",
      "required": ["as", "value"],
      "additionalProperties": false,
      "properties": {
        "as": {
          "enum": [
            "form-json-field",
            "multipart-json-part",
            "query-json-parameter",
            "querystring-json",
            "json-lines",
            "json-sequence"
          ]
        },
        "name": { "type": "string", "minLength": 1 },
        "names": {
          "type": "array",
          "minItems": 1,
          "items": { "type": "string", "minLength": 1 }
        },
        "value": {}
      },
      "allOf": [
        {
          "if": {
            "properties": {
              "as": {
                "enum": ["form-json-field", "multipart-json-part", "query-json-parameter"]
              }
            },
            "required": ["as"]
          },
          "then": { "required": ["name", "names"] },
          "else": {
            "not": {
              "anyOf": [
                { "required": ["name"] },
                { "required": ["names"] }
              ]
            }
          }
        }
      ]
    }
  },
  "allOf": [
    {
      "if": {
        "properties": {
          "format": { "const": "openbindings.binding-spec-processor-scenarios@5" }
        },
        "required": ["format"]
      },
      "else": {
        "properties": {
          "scenarios": {
            "items": {
              "properties": {
                "expected": {
                  "items": {
                    "properties": {
                      "assertions": {
                        "items": {
                          "not": { "required": ["semanticEquals"] }
                        }
                      }
                    }
                  }
                }
              }
            }
          }
        }
      }
    }
  ]
}
