{
  "format": "openbindings.binding-spec-processor-scenarios@1",
  "bindingSpec": "openbindings.mcp@1",
  "family": "mcp",
  "description": "Portable MCP first-revision-candidate scenarios for negotiation, listing resolution, application-contract eligibility, whole-value input, structured output projection, failure classification, and credentials.",
  "scenarios": [
    {
      "id": "MCP-PS-01",
      "rules": [
        "MCP-P-01"
      ],
      "section": "3",
      "description": "A negotiated MCP revision outside the singleton envelope is refused before listing or invocation.",
      "given": {
        "source": {
          "location": "https://mcp.example/rpc"
        },
        "binding": {
          "selector": "tools/weather"
        },
        "invocation": {
          "inputPresent": true,
          "input": {}
        },
        "peer": {
          "negotiatedProtocolVersion": "2026-01-01"
        }
      },
      "expected": [
        {
          "disposition": "refusal",
          "phase": "load",
          "assertions": [
            {
              "path": "/listingRequests",
              "absent": true
            },
            {
              "path": "/dispatch",
              "absent": true
            }
          ]
        }
      ]
    },
    {
      "id": "MCP-PS-02",
      "rules": [
        "MCP-P-02",
        "MCP-P-04"
      ],
      "section": "3",
      "description": "A live tool listing is pagination-exhausted before an eligible selector is resolved and dispatched.",
      "given": {
        "source": {
          "location": "https://mcp.example/rpc"
        },
        "binding": {
          "selector": "tools/weather"
        },
        "invocation": {
          "inputPresent": true,
          "input": {
            "city": "Oslo"
          }
        },
        "peer": {
          "negotiatedProtocolVersion": "2025-11-25",
          "capabilities": {
            "tools": {}
          },
          "toolPages": [
            {
              "tools": [
                {
                  "name": "clock",
                  "inputSchema": {
                    "type": "object"
                  },
                  "outputSchema": {
                    "type": "object"
                  }
                }
              ],
              "nextCursor": "p2"
            },
            {
              "tools": [
                {
                  "name": "weather",
                  "inputSchema": {
                    "type": "object"
                  },
                  "outputSchema": {
                    "type": "object",
                    "properties": {
                      "condition": {
                        "type": "string"
                      }
                    },
                    "required": [
                      "condition"
                    ]
                  }
                }
              ]
            }
          ],
          "toolResult": {
            "content": [
              {
                "type": "text",
                "text": "clear"
              }
            ],
            "structuredContent": {
              "condition": "clear"
            }
          }
        }
      },
      "expected": [
        {
          "disposition": "complete",
          "phase": "completion",
          "assertions": [
            {
              "path": "/listingRequests/tools",
              "equals": [
                null,
                "p2"
              ]
            },
            {
              "path": "/dispatch/method",
              "equals": "tools/call"
            },
            {
              "path": "/outputs/0",
              "equals": {
                "condition": "clear"
              }
            }
          ]
        }
      ]
    },
    {
      "id": "MCP-PS-03",
      "rules": [
        "MCP-P-03"
      ],
      "section": "9.1",
      "description": "A supplied non-object tool input is refused before tools/call.",
      "given": {
        "source": {
          "location": "https://mcp.example/rpc",
          "content": {
            "tools": [
              {
                "name": "weather",
                "outputSchema": {
                  "type": "object"
                }
              }
            ]
          }
        },
        "binding": {
          "selector": "tools/weather"
        },
        "invocation": {
          "inputPresent": true,
          "input": null
        }
      },
      "expected": [
        {
          "disposition": "refusal",
          "phase": "pre-dispatch",
          "assertions": [
            {
              "path": "/dispatch",
              "absent": true
            }
          ]
        }
      ]
    },
    {
      "id": "MCP-PS-04",
      "rules": [
        "MCP-P-04"
      ],
      "section": "8",
      "description": "The first-revision candidate does not solicit or emit MCP progress even when an unused solicit option is present.",
      "given": {
        "source": {
          "location": "https://mcp.example/rpc",
          "content": {
            "tools": [
              {
                "name": "build",
                "outputSchema": {
                  "type": "object",
                  "properties": {
                    "done": {
                      "type": "boolean"
                    }
                  },
                  "required": [
                    "done"
                  ]
                }
              }
            ]
          }
        },
        "binding": {
          "selector": "tools/build"
        },
        "configuration": {
          "solicit": true
        },
        "invocation": {
          "inputPresent": true,
          "input": {}
        },
        "peer": {
          "progress": [
            {
              "progressToken": "t1",
              "progress": 0,
              "total": 0
            }
          ],
          "toolResult": {
            "content": [
              {
                "type": "text",
                "text": "done"
              }
            ],
            "structuredContent": {
              "done": true
            }
          }
        }
      },
      "expected": [
        {
          "disposition": "complete",
          "phase": "completion",
          "assertions": [
            {
              "path": "/outputs",
              "equals": [
                {
                  "done": true
                }
              ]
            },
            {
              "path": "/dispatch/params/_meta/progressToken",
              "absent": true
            }
          ]
        }
      ]
    },
    {
      "id": "MCP-PS-05",
      "rules": [
        "MCP-P-04"
      ],
      "section": "9.2",
      "description": "A successful tool emits structuredContent alone and drops the MCP result wrapper from the ordinary value.",
      "given": {
        "source": {
          "location": "https://mcp.example/rpc",
          "content": {
            "tools": [
              {
                "name": "inspect",
                "outputSchema": {
                  "type": "object",
                  "properties": {
                    "value": {
                      "type": "integer"
                    }
                  },
                  "required": [
                    "value"
                  ]
                }
              }
            ]
          }
        },
        "binding": {
          "selector": "tools/inspect"
        },
        "invocation": {
          "inputPresent": false
        },
        "peer": {
          "toolResult": {
            "content": [
              {
                "type": "text",
                "text": "human"
              }
            ],
            "structuredContent": {
              "value": 7
            },
            "isError": false,
            "_meta": {
              "trace": "abc"
            }
          }
        }
      },
      "expected": [
        {
          "disposition": "complete",
          "phase": "completion",
          "assertions": [
            {
              "path": "/outputs/0",
              "equals": {
                "value": 7
              }
            },
            {
              "path": "/outputs/0/content",
              "absent": true
            },
            {
              "path": "/outputs/0/_meta",
              "absent": true
            }
          ]
        }
      ]
    },
    {
      "id": "MCP-PS-06",
      "rules": [
        "MCP-P-06"
      ],
      "section": "9.3",
      "description": "A tools/call isError result is unsuccessful and is not emitted as an operation value.",
      "given": {
        "source": {
          "location": "https://mcp.example/rpc",
          "content": {
            "tools": [
              {
                "name": "fail",
                "outputSchema": {
                  "type": "object"
                }
              }
            ]
          }
        },
        "binding": {
          "selector": "tools/fail"
        },
        "invocation": {
          "inputPresent": true,
          "input": {}
        },
        "peer": {
          "toolResult": {
            "content": [
              {
                "type": "text",
                "text": "bad input"
              }
            ],
            "isError": true
          }
        }
      },
      "expected": [
        {
          "disposition": "error",
          "phase": "response",
          "assertions": [
            {
              "path": "/outputs",
              "equals": []
            }
          ]
        }
      ]
    },
    {
      "id": "MCP-PS-07",
      "rules": [
        "MCP-P-07"
      ],
      "section": "9.4",
      "description": "A generic credential with no named HTTP-header carriage is surfaced rather than mapped privately.",
      "given": {
        "source": {
          "location": "https://mcp.example/rpc",
          "content": {
            "tools": [
              {
                "name": "hello",